{
  "id": "deck_trans_001",
  "name": "变通组",
  "archetype": "拟态流",
  "bodyId": "body_trans_001",
  "characterIds": [
    "char_055_xiaoapan_judge",
    "char_033_weixiaokele_watcher",
    "char_017_huihuan_defect-robot",
    "char_032_weixiaokele_silent-hunter",
    "char_027_weixiaokele_medium",
    "char_020_baizi_ironclad",
    "char_018_baizi_defect-robot",
    "char_023_arthur_falcon",
    "char_037_keke_seer",
    "char_016_baizi_gravy",
    "char_013_weixiaokele_morphling",
    "char_014_baizi_party-duck",
    "char_051_baizi_lobbyist",
    "char_012_baizi_bird-eater",
    "char_019_dong_defect-robot",
    "char_066_linglong_ninja"
  ],
  "notes": "拟态流以将牌当作其他牌使用为核心，并加入三张共享充能球的故障机器人：积攒充能球后可转化为减伤、虚拟【杀】或技能降费。Mega 后临时上阵角色首次发动【休整X】技能时可降低费用，形成连续变通操作。"
}
