{
  "id": "deck_aggro_001",
  "name": "上头组",
  "archetype": "爆杀流",
  "bodyId": "body_aggro_001",
  "characterIds": [
    "char_001_keke_assassin",
    "char_002_weixiaokele_assassin",
    "char_003_qindi_sheriff",
    "char_004_horus-lupercal_pelican",
    "char_005_aichitun_jester",
    "char_006_weixiaokele_ninja",
    "char_007_baizi_ninja",
    "char_008_baizi_hitman",
    "char_009_weixiaokele_hitman",
    "char_010_weixiaokele_bomber",
    "char_011_baizi_bomber",
    "char_012_baizi_bird-eater",
    "char_013_weixiaokele_morphling",
    "char_014_baizi_party-duck",
    "char_015_weixiaokele_lobbyist",
    "char_016_baizi_gravy"
  ],
  "notes": "检索并强化【杀】，连续进攻压低对手血线。"
}
