{
  "id": "deck_blood_001",
  "name": "逆命组",
  "archetype": "卖血流",
  "bodyId": "body_blood_001",
  "characterIds": [
    "char_001_keke_assassin",
    "char_003_qindi_sheriff",
    "char_020_baizi_ironclad",
    "char_022_weixiaokele_goblin",
    "char_052_fengyaojing_desert-butcher",
    "char_073_xiaoapan_bee-medic",
    "char_087_qindi_vigilante",
    "char_088_horus-lupercal_serial-killer",
    "char_089_kabishou_canadian",
    "char_090_miaosila_medium",
    "char_091_zongzi_vulture",
    "char_092_player_detective",
    "char_093_tutu_snitch",
    "char_094_daidaishou_astral",
    "char_095_pangpanghali_prophet",
    "char_096_kabishou_politician"
  ],
  "notes": "通过承受伤害触发判定，以红色结果补充资源、黑色结果干扰手牌，并在低血状态利用Z招式回收关键牌完成逆转。"
}
