{
  "id": "deck_ambush_001",
  "name": "幽幕组",
  "archetype": "伏击流",
  "bodyId": "body_ambush_001",
  "characterIds": [
    "char_034_xiaoapan_avenger",
    "char_035_xiaoapan_silent-hunter",
    "char_045_guamao_assassin",
    "char_074_huihuan_nameless",
    "char_071_xiangcai_lover",
    "char_087_qindi_vigilante",
    "char_089_kabishou_canadian",
    "char_097_horus-lupercal_bird-eater",
    "char_098_qindi_silencer",
    "char_072_guamao_lover",
    "char_101_pangpanghali_identity-thief",
    "char_104_player_falcon",
    "char_105_tutu_professional",
    "char_106_qindi_vulture",
    "char_107_daidaishou_engineer",
    "char_108_tutu_birdwatcher"
  ],
  "notes": "以暗置角色响应对手行动，伏击角色支付费用后由本体持续补位；恋人组合通过连续退场完成爆发与角色压制，Z招式可在关键回合重新调用退场区伏击。"
}
