{
  "id": "deck_combo_001",
  "name": "操作组",
  "archetype": "行动流",
  "bodyId": "body_combo_001",
  "characterIds": [
    "char_054_xiangcai_prophet",
    "char_056_huihuan_watcher",
    "char_057_guamao_silent-hunter",
    "char_058_xiangcai_politician",
    "char_059_dong_justice",
    "char_060_linglong_defect-robot",
    "char_061_xiangcai_watcher",
    "char_062_guamao_morphling",
    "char_063_dong_assassin",
    "char_064_huihuan_pelican",
    "char_065_dong_high-priest",
    "char_066_linglong_ninja",
    "char_067_xiangcai_neo",
    "char_068_huihuan_bird-eater",
    "char_069_dong_sheriff",
    "char_070_huihuan_silent-hunter"
  ],
  "notes": "行动流以使用行动牌触发本体被动脉冲：找行动牌→使用→摸牌→控牌堆→回收→继续操作。不强攻不控制，靠行动牌利用率与牌差碾压。"
}
